{
  "$schema": "https://json-schema.org/draft/2020-12/schema",
  "$id": "https://schemas.shabis-academy.dev/aos/v1/prompt-candidate.schema.json",
  "title": "Prompt Candidate",
  "description": "A generated Prompt Pack or individual prompt candidate produced by the knowledge-ingestion pipeline (see .agent/research/knowledge-ingestion.md step 19).",
  "type": "object",
  "properties": {
    "id": {
      "type": "string"
    },
    "title": {
      "type": "string"
    },
    "summary": {
      "type": "string"
    },
    "sourceIds": {
      "type": "array",
      "items": { "type": "string" },
      "minItems": 1
    },
    "reviewStatus": {
      "type": "string",
      "enum": [
        "discovered",
        "extracted",
        "verified",
        "translated",
        "pendingReview",
        "approved",
        "published",
        "warning",
        "stale",
        "deprecated",
        "rejected"
      ]
    },
    "freshnessStatus": {
      "type": "string",
      "enum": ["current", "aging", "stale", "deprecated", "superseded", "historical"]
    },
    "translationStatus": {
      "type": "string",
      "enum": ["notStarted", "inProgress", "complete"]
    },
    "confidence": {
      "type": "number",
      "minimum": 0,
      "maximum": 1
    },
    "generatedBy": {
      "type": "object",
      "properties": {
        "agent": { "type": "string" },
        "generatedDate": { "type": "string", "format": "date" }
      },
      "required": ["agent", "generatedDate"],
      "additionalProperties": false
    },
    "version": {
      "type": "string"
    },
    "createdDate": {
      "type": "string",
      "format": "date"
    },
    "promptText": {
      "type": "string",
      "description": "The full prompt content being proposed."
    },
    "category": {
      "type": "string",
      "description": "Prompt Pack / Prompt Library category, per .agent/knowledge/prompt-engineering.md."
    },
    "targetModel": {
      "type": "string",
      "description": "Model or model family this prompt was designed/tested against, if known."
    }
  },
  "required": [
    "id",
    "title",
    "summary",
    "sourceIds",
    "reviewStatus",
    "freshnessStatus",
    "confidence",
    "generatedBy",
    "version",
    "createdDate",
    "promptText",
    "category"
  ],
  "additionalProperties": false
}
